title,content,url,Fuente
Las claves de la propuesta del PSOE para cambiar la acusación popular y suprimir el delito contra sentimientos religiosos,"El PSOE ha registrado este viernes en el Congreso de los Diputados una proposición de leycon la que trata de acabar con el mal ejercicio de la acusación popular, las causas judiciales con motivaciones políticas, los pronunciamientos de jueces y fiscales sobre asuntos judicializados y los delitos de ofensas contra los sentimientos religiosos. Se trata de la proposición de Ley Orgánica de Garantía y Protección de los Derechos Fundamentales frente al Acoso Derivado de Acciones Judiciales Abusivas.
La reforma propone la modificación del Real Decreto de 14 de septiembre de 1882 por el que se aprueba la Ley de Enjuiciamiento Criminal, la supresión del artículo 525 del Código Civil y la reforma de la Ley Orgánica del Poder Judicial.
Estos son los puntos principales que trata la proposición de ley:",https://www.eldiario.es/politica/claves-propuesta-psoe-cambiar-acusacion-popular-suprimir-delito-sentimientos-religiosos_1_11954953.html,ElDiario
Los ministros de Sumar exhiben unidad en su presión al PSOE para aprobar con urgencia la reducción de jornada,"Sumar sigue escalando su presión contra el PSOEen plena pugna por la reducción de la jornada laboral, su medida estrella para la legislatura. Este viernes, los cinco ministros de la coalición se han reunido en la sede de Trabajo para analizar la coyuntura política en el inicio de año y han lanzado un mensaje contra su socio de Gobierno al que acusan de incumplir el acuerdo que firmaron hace un año y que contemplaba entre otros asuntos aprobar la reducción de la jornada laboral a 37,5 horas semanales antes de que terminase 2025.
En una reunión a puerta cerrada, sin comparecencias de prensa posteriores, Yolanda Díaz, vicepresidenta segunda, Yolanda Díaz, así como Pablo Bustinduy, ministro de Derechos Sociales, Mónica García, de Sanidad, Ernest Urtasun, de Cultura, y Sira Rego, de Infancia y Juventud, han exigido que se apruebe la reforma “con carácter de urgencia” en el Consejo de Ministros para que comience la tramitación parlamentaria “y que esta importante medida llegue a los trabajadores y trabajadoras españolas en 2025, tal y como figura en el acuerdo de Gobierno”, tal y como han trasladado fuentes de la coalición al término del encuentro.
“El acuerdo de diálogo social firmado por el Gobierno con los sindicatos CCOO y UGT el 20 de diciembre debe ser respetado íntegramente por el Consejo de Ministros”, sostienen esas mismas fuentes que constatan que el Partido Socialista está incumpliendo el acuerdo que ambos partidos firmaron en noviembre de 2023 para revalidar el gobierno de coalición progresista.",https://www.eldiario.es/politica/ministros-sumar-exhiben-unidad-presionar-psoe-aprobar-urgencia-reduccion-jornada-laboral_1_11954533.html,ElDiario
El discurso del rey en la Pascua Militar omitió un párrafo que calificaba a la dictadura franquista como “una página oscura”,"Una primera versión del discurso que el rey Felipe VI iba a leer durante la pasada Pascua Militar, el 6 de enero, contenía una alusión a la dictadura de Franco como “una página oscura de nuestra historia común y un tiempo de división de los españoles, hoy felizmente superado”. Ese borrador llegó incluso a estar colgado en la página web de la Casa Real y luego fue retirado y sustituidopor el texto definitivo.
En el discurso que el monarca pronunció finalmente ante la cúpula de los tres Ejércitos y la Guardia Civil, la referencia a la dictadura fue omitida.
El párrafo completo que figuró en la versión inicial del discurso decía lo siguiente: “En el calendario de 2025 tenemos también muchas fechas señaladas: en primer lugar, se cumplen cincuenta años de los hechos que dieron paso al proceso de transformación de nuestras Fuerzas Armadas, ya desde los albores de nuestra democracia; un proceso de transformación que empezó tras el fin de la dictadura -una página oscura de nuestra historia común y un tiempo de división de los españoles, hoy felizmente superado- y tras la llegada al trono de mi Padre, el Rey don Juan Carlos. Una metamorfosis que fue vital para el afianzamiento de la democracia en España y en el que la Corona desempeñó un papel esencial”.",https://www.eldiario.es/politica/discurso-rey-pascua-militar-omitio-parrafo-calificaba-dictadura-franquista-pagina-oscura_1_11953153.html,ElDiario
"Última hora sobre la actualidad política, en directo","España entra en laespiral de tensión y confusión en torno a la crisis política en Venezuela. Ayer las derechas se manifestaron en Madrid acompañando a miles de venezolanos que protestan contra Maduro y apoyan a la oposición de María Corina Machado y Edmundo González. PP y Vox tratan de aprovechar el tirón.
El siguiente asunto que ocupa este viernes nuestra portada sonlas mentiras de Miguel Ángel Rodríguez sobre la “ejemplar” pareja de Ayuso. El director de elDiario.es,Ignacio Escolar, hace un repaso con datos a las falsedades, omisiones y medias verdades que pronunció ayer el jefe de gabinete de Ayuso.
Tenemos, además, crónica deIñigo Sáenz de Ugartesobre el desembarco de ministros en la política territorial:El PSOE se receta una descarga de miles de voltios con el pluriempleo de ministras.",https://www.eldiario.es/politica/ultima-hora-actualidad-politica-directo_6_11953650.html,ElDiario
Feijóo es bolca amb Mazón malgrat els forats en la gestió de la DANA i les protestes ciutadanes,"“Carlos, estem orgullosos que seguisques treballant i donant la cara”. Les paraules són d'Alberto Núñez Feijóo, i el Carles que l'enorgulleix és Mazón, el president de la Generalitat Valenciana que va estar absent durant hores el 29 d'octubre passat, el dia de la DANA que va provocar pluges torrencials, el desbordament de rius i canals i, com a conseqüència, 224 morts. Tot i les contradiccions del president, els forats en la gestió de les tempestes, lesmultitudinàries manifestacionsque han demanat la seva dimissió, Feijóo ha decidit arrancar el 2025 amb un tancament de files absolut amb Mazón, que ha de ratificar el seu lideratge al capdavant del PPCV aquest mateix any.
El líder de l'oposició ha elegit la Comunitat Valenciana per fer el seu primer viatge del 2025, com s'han encarregat de remarcar tant ell com el seu equip de comunicació. Un periple de dos dies per la província afectada per la DANA del 29 d'octubre amb dos jornades ben diferenciades. La primera, en secret i en solitari, per conèixer “de primera mà” l'estat de la “reconstrucció” dels quantiosos danys materials provocats per les riuades.
Aquest dia Feijóo no es va deixar gravar pels periodistesi va preferir no deixar-se veure amb Mazón. Tot i els aplaudiments que rep el líder del PP valencià dels seus diputats o càrrecs orgànics, els carrers de la capital valenciana s'han omplit fins a tres vegades per protestar per la gestió de la DANA, en particular per les hores que Mazón va estar en un luxós restaurant, suposadament menjant amb una periodista a qui, segons el relat de la Generalitat, hauria oferit en aquest dinar dirigir la televisió pública autonòmica.",https://www.eldiario.es/politica/feijoo-bolca-amb-mazon-malgrat-els-forats-gestio-dana-i-les-protestes-ciutadanes_1_11953167.html,ElDiario
