title,content,url,Fuente
Miguel Ángel Rodríguez pone en cuestión el relato de la pareja de Ayuso al ser obligado a decir la verdad en el Supremo,"Miguel Ángel Rodríguezse encontró este miércoles en el Tribunal Supremo con la obligación de decir la verdad. Su declaración como testigo, que se alargó durante 45 minutos, reveló que la pareja de Isabel Díaz Ayuso y su defensa llevan meses ocultando a los tribunales que ellos mismos hicieron circular correos confidenciales sobre su caso. La declaración del jefe de gabinete también evidenció el intento del entorno del empresario de ofrecer, fuera del despacho del juez, una versión diferente a la que había relatado dentro del Supremo Miguel Ángel Rodriguez.
El magistrado Ángel Hurtado tiene ahora por delante la decisión de indagar en la posible incidencia que todo eso haya tenido en un procedimiento que avanza a varias velocidades, pero en todo caso de forma más acelerada quela causa originalpor fraude fiscal contra Alberto González Amador. Rodríguez estaba citado como testigo en lacausa abiertacontra el fiscal general del Estado, Álvaro García Ortiz, por la supuesta difusión a la prensa de un email relacionado con esa investigación, lo que podría constituir un delito de revelación de secretos. Sin embargo, ante el juez, Rodríguez admitió que tuvo en su poder uno de los correos que intercambiaron el fiscal del caso, Julián Salto, y la defensa del comisionista muchas horas antes de que el fiscal general tuviera acceso a ellos.
Distintas fuentes presentes en la declaración señalaron que la mano derecha de Ayuso puntualizó que dispuso desde la mañana del 12 de marzo —poco después de que elDiario.esdestapase el caso— de uno de los correos de esa cadena, firmado por el fiscal y fechado ese mismo día. Según la versión que dio en el Supremo, se lo facilitó el abogado del comisionista y él lo retuvo durante “38 horas” hasta que a las 22.27 horas del 13 de marzo envió su contenido a un grupo de mensajería en el que estaban medio centenar de periodistas una vez que el contenido ya había sido difundido por dos medios: El Mundo y La Sexta.",https://www.eldiario.es/politica/miguel-angel-rodriguez-pone-cuestion-relato-pareja-ayuso-obligado-decir-supremo_1_11950098.html,El Diario
Sánchez alerta del impulso “totalitario” que lidera Musk en el acto por la muerte de Franco: “Puede volver a ocurrir”,"No dar por sentada la libertad y la democracia ni los derechos conquistados en los últimos 50 años. Con ese mensaje ha dado Pedro Sánchez el pistoletazo de salida al centenar de actos programados durante todo 2025 bajo el lema “50 años de libertad” y que conmemora el final de la dictadura por muerte de Franco en 1975.
“El fascismo que creímos dejar atrás es ya la tercera fuerza política de Europa, la internacional reaccionaria liderada por el hombre más rico del planeta ataca a nuestras instituciones, azuza el odio y llama abiertamente a apoyar a los herederos del nazismo en Alemania”, ha afirmado el presidente del Gobierno en referencia a Elon Musk, antes de pedir a la sociedad española un compromiso explícito con los valores democráticos y no dar por sentada ninguna conquista.
“La libertad nunca se conquista de forma permanente, es algo que se puede perder, como se perdió hace un siglo. Puede volver a ocurrir”, ha alertado. Sánchez ha pedido en la lucha por la defensa de las libertades el compromiso de todos los actores políticos independientemente de su ideología, en clara referencia a la ausencia del principal partido de la oposición. “No hace falta ser progresista, solo hace falta ser demócrata”.",https://www.eldiario.es/politica/sanchez-alerta-impulso-totalitario-lidera-musk-acto-muerte-franco-volver-ocurrir_1_11948642.html,El Diario
"Esperanza Aguirre, Rosa Díez o Cebrián piden en un manifiesto boicotear los actos del Gobierno por la muerte de Franco","Un manifiesto firmado por casi un centenar de políticos, intelectuales, periodistas y artistas conservadores llama a “boicotear” los actos del Gobierno para celebrar la llegada de la democracia a España tras la muerte de Franco hace 50 años. Los firmantes, entre los que figuran destacados exdirigentes del PSOE e intelectuales que con los años han ido escorándose hacia la derecha, califican esos eventos de “aquelarre guerracivilista”. Entre los que suscriben el texto están Esperanza Aguirre, Federico Jiménez Losantos, Rosa Díez, Joaquín Leguina o Juan Luis Cebrián.
El manifiesto, tituladoContra Franco: la Constitución es la única celebración posible, está promovido la plataforma 'Libres e iguales', que se presentó en 2014 como un “movimiento cívico transversal”.
La programación de los eventos les parece “un subterfugio” del Gobierno “para celebrar la muerte de Franco”. Consideran que “no pocas” víctimas de la guerra y la dictadura también habían sido “victimarios”,es decir, asesinos,y afirman que quienes ganaron la guerra civil “renunciaron al poder que disfrutaban” durante la Transición.",https://www.eldiario.es/politica/esperanza-aguirre-rosa-diez-cebrian-piden-manifiesto-boicotear-actos-gobierno-muerte-franco_1_11948188.html,El Diario
Miguel Ángel Rodríguez reconoce en el Supremo que filtró uno de los correos del fiscal del caso de la pareja de Ayuso,"Miguel Ángel Rodríguez, jefe de gabinete de Isabel Díaz Ayuso, ha reconocido en su declaración como testigo en el Tribunal Supremo que filtró a varios medios de comunicación el contenido de un correo confidencial cruzado entre el abogado de Alberto González Amador, pareja de la presidenta de la Comunidad de Madrid, y el fiscal que le investigaba por fraude fiscal, Julián Salto. No obstante, ha negado haber difundido el email concreto que investiga el alto tribunal y ha asegurado que desconocía su contenido.
“Ese es el texto que yo difundo [correspondiente a un correo del 12 de marzo de 2024] y había un email anterior [del 2 de febrero, en el que González Amador reconocía el fraude y ofrecía el pacto] que yo desconocía y que el señor Salto tampoco cita”, se ha justificado a la salida, tras declarar durante casi una hora ante el juez que investiga al fiscal general del Estado, Álvaro García Ortiz.
Posteriormente, fuentes jurídicas presentes en la declaración han asegurado que Rodríguez también ha reconocido ante el juez Ángel Hurtado que tuvo ese correo porque se lo facilitó el abogado de González Amador. A las puertas del tribunal, el jefe de gabinete ha cambiado su versión y ha afirmado que fue el empresario el que le hizo llegar ese correo en la mañana del 12 de marzo, poco después de que elDiario.esdestapase  el caso.",https://www.eldiario.es/politica/miguel-angel-rodriguez-reconoce-salida-supremo-filtro-correos-pareja-ayuso_1_11947715.html,El Diario
"Última hora sobre la actualidad política, en directo","Este martes viene lleno de actualidad política, principalmente por ladeclaración como testigo de Miguel Ángel Rodríguez, jefe de gabinete de Isabel Díaz Ayuso, en el Tribunal Supremo. Rodríguez, que ayer fuedenunciado por el PSOEpor filtrar datos personales de dos reporteros, ha testificado en la causa contra elfiscal general del Estado, Álvaro García Ortiz, y ha reconocido quefiltró uno de los correos de la pareja de Ayuso. También estaban citados un periodista deEl Mundoy otro deLaSexta.
El Gobierno ha iniciado este miércoles en Madrid losactos de conmemoraciónde los 50 años de la muerte del dictador Francisco Franco, donde el presidente del Ejecutivo Pedro Sánchez ha alertado del impulso “totalitario” que, ha dicho, lidera Elon Musk. Mientras, las derechas agitan la acusación de 'guerracivilismo' para no hablar del franquismo.
Además, Íñigo Errejón, exlíder de Más País, declara hoy en el juzgado por la presunta vulneración del honor de un jubilado de 67 años, al que acusó de ponerle una denuncia falsa. El hombre, vecino de Lavapiés, le denunció en 2021 alegando que Errejón le había dado una patada en la tripa, y tras quedar el exparlamentarioabsuelto por falta de pruebas, el jubilado le volvió a denunciar.",https://www.eldiario.es/politica/ultima-hora-actualidad-politica-directo_6_11947555.html,El Diario
