title,content,url,Fuente
Los senadores del PP de Segovia piden al Gobierno que “deje de hacer caja con el esfuerzo de los españoles asfixiados a impuestos”,"El Grupo Parlamentario Popular en el Senado, del que forman parte la presidenta del PP de SEgovia, Paloma Sanz; el vicepresidente 1º de la Cámara, Javier Maroto y los senadores, Juan José Sanz Vitorio y Mª Ángeles García, exige al Gobierno que “ponga fin a su hachazo fiscal” a costa de “meter la mano en el bolsillo de los españoles”. “Ya está bien de hacer caja con el esfuerzo de los españoles asfixiados a impuestos”, indican.
“Desde que Sánchez llegó a la Moncloa la subida de impuestos ya roza el riesgo los puestos de trabajo del sector de la peluquería, centenar. Con el nuevo año incorpora 9 subidas de impuestos más”, explican los senadores segovianos, al tiempo que recuerdan que con “Sánchez las familias pagan más impuestos que nunca, ya que ahora cada español paga 2.600 euros más en impuestos al año, mientras que el Estado recauda un 43% más que en 2018. Esto es insoportable”. Así, reprochan que desde el Ministerio de Hacienda suban el IVA al 4% a los alimentos básicos, como el pan o los huevos; mientras que otros alimentos como la pasta pasan del 7,5% al 10%. “Basta ya de ahogar a los españoles y a su cartera”, inciden los populares.
“Exigimos al Congreso que deje de retener esta ley del PP. Es la primera de las 15 leyes Feijóo aprobadas en el Senado, y Armengol niega el debate por miedo a perder la votación”, subrayan los populares, y explican que se trata de una reivindicación que el sector lleva pidiendo desde hace 12 años para mantener la actividad y el empleo. “¿Y cuál ha sido la postura del Gobierno? Rechazar cualquier tipo de mejoras impositivas alegando siempre falsas excusas”.",https://www.larazon.es/castilla-y-leon/senadores-segovia-piden-gobierno-que-deje-hacer-caja-esfuerzo-espanoles-asfixiados-impuestos_20250108677eb379bc785b000174b2f9.html,La Razón
"La socialista Rosa Sánchez, nueva alcaldesa de Alhama de Murcia al prosperar la moción de censura contra el PP","Lasocialista Rosa SánchezBishopha sido designada este miércoles nueva alcaldesa de Alhama de Murcia al prosperar la moción de censura presentada conjuntamente porPSOE, IU-Verdes y el edil Antonio Sibinaen contra de la anterior regidora, la 'popular' María Cánovas.
La moción ha salido adelante en elPleno extraordinario convocado este miércolesgracias a los votos a favor de los ocho ediles del PSOE, los dos de IU-Verdes y el concejal Antonio Sibina.
Los 11 ediles que han respaldado la moción de censura hansumado una mayoría suficiente en un Pleno compuesto por 21 edilesy han puesto fin al mandato de Cánovas, que estaba gobernando desde el inicio de la legislatura tras las elecciones municipales de mayo de 2023.",https://www.larazon.es/murcia/psoe-saca-adelante-mocion-censura-alhama-murcia-nombra-rosa-sanchez-nueva-alcaldesa_20250108677e6eb5af2175000149a0d9.html,La Razón
Badenas (Vox) gasta 15.000 euros en una encuesta sobre la afección de la Dana en los jardines de Valencia,"El grupo Compromís en el Ayuntamiento de Valencia ha denunciado que el concejal de Jardines,Juanma Badenas,portavoz a su vez de Vox,ha adjudicado a dedo dos encuestas por valor de 30.000 euros a Target Point,una empresa que los nacionalistas afirman que está vinculada con la extrema derecha y con los ""chiringuitos de Vox"".
Una de las encuesta es sobre la sobrela gestión de la Dana en parques y jardines de la ciudad de Valencia.Lo primero que llama la atención es que la ciudad de Valencia no se vio afectada por la ""tormenta"" que pregunta la encuesta, sino por la barrancada del barranco del Poyo.
El concejal de Compromís, Sergi Campillo, ha señalado que solo el tres por ciento de los encuestados viven en las pedanías de la ciudad afectadas por al Dana y ha puesto el acento en que en la encuesta se preguntan cosas que nada tiene que ver con el episodio catastrófico de lluvias fuertes. en este sentido, ha denunciado que se pregunta porlos migrantes que duermen debajo de los puentes del Jardín del Turiay que desde Vox se aboga por tirarlos de allí o por construir estanques para impedir su estancia.",https://www.larazon.es/comunidad-valenciana/badenas-vox-gasta-15000-euros-encuesta-afeccion-dana-jardines-valencia_20250108677e69ddbc785b0001745bea.html,La Razón
"El PSOE de Medina del Campo exige la ""renuncia inmediata"" del concejal de Vox por ""Enaltecimiento del Franquismo""","El Grupo Municipal Socialista de la localidad vallisoletana de Medina del Campoha demandado, ante el registro municipal, larenuncia inmediata del concejal de Vox, Alberto Amigo, tras la publicación en la red social “WhatsApp” de ""una felicitación promoviendo, de manera innecesaria, el franquismo"".
Fuentes socialistas señalaron que""aprovechando la herramienta que da esta red social, Amigo quiso felicitar las Navidades y el año nuevo con una imagen del Valle de los Caídos, la bandera pre y anticonstitucional"", y un“Arriba España”, evocando y promoviendo el franquismo. Estas acciones, según el Grupo Municipal Socialista, representan""una inaceptable agresión a los principios democráticos y a la representación institucional que un concejal de un ayuntamiento como el de Medina debería defender"".
El secretario general de los socialistas en Medina del Campo, Luis Manuel Pascual, ha afirmado:""No podemos permitir que un representante público incite al odio y a la división en nuestro municipio. Exigimos al Gobierno Municipal que tome medidas al respecto, y alos grupos del Partido Popular y Medina Primero, resto del tripartito, que condenen esta forma de promoción del fascismo.Hemos esperado a que pasasen las fiestas navideñas, pero esta demanda es totalmente necesaria, por que vemos que a pesar de que esta semana se inician los actos de los 50 años de la muerte de Franco, aún hoy seguimos viendo este tipo de comportamientos, que enfrentan a la población”.",https://www.larazon.es/castilla-y-leon/psoe-medina-campo-exige-renuncia-inmediata-concejal-vox-enaltecimiento-franquismo_20250108677e65cb4f1fb7000181cad3.html,La Razón
"El podcast de Carmen Morodo: Pues sí, es el ""puto amo""","En su podcast de hoy, Carmen Morodo, subdirectora de LA RAZÓN, asegura que ""los delfines del presidente del Gobierno van a desembarcar en cada uno de los territorios elegidos por decisión de Pedro Sánchez sin apenas oposición"". Asegura que las críticas han quedado ""soterradas"" gracias a la maquinaria de Ferraz que, una vez más, ha funcionado.
Asimismo, destaca que si hay algo que le viene bien a un partido es que en unas primarias, el proceso de renovación se haga ""sin discusión, sin debate y sin guerras internas"". O al menos, afirma, que esas crisis internas no se visualicen ante la opinión pública.",https://www.larazon.es/podcast/podcast-carmen-morodo-pues-puto-amo_20250108677d9590bc785b000173d627.html,La Razón
Pedro Sánchez ficha como portero suplente del Real Madrid para la próxima temporada," El presidente del Gobierno ha sorprendido al mundo del deporte al firmar un contrato como tercer portero del Real Madrid. Según el club, Sánchez ha estado entrenando en secreto durante las madrugadas en las instalaciones de La Moncloa. Florentino Pérez destacó sus reflejos y su capacidad para ""parar todos los ataques, tanto deportivos como políticos",https://www.larazon.es/podcast/podcast-carmen-morodo-pues-puto-amo_20250108677d9590bc785b000173d627.html,La Razón